Year,Month,Day,Source,Title,Body,Link
2022,Dec,20,NR,Discussion held on whitefly damage to coconut plantations,"A discussion on the sustainable management of the Whitefly pest that harms coconut plantations, was held yesterday at the Presidential Secretariat under the patronage of Presidents Secretary Saman Ekanayake and Prezs Director General (Community Affairs) Keerthi Tennakoon. The responsible institutions including the Coconut Research Institute held various awareness programmes, to educate coconut planters of the pest and measures more..",https://newsradio.lk/blog/discussion-held-on-whitefly-damage-to-coconut-plantations/
2023,Jan,7,ST,White fly infestation set to drive coconut prices higher,"Prices of coconut and king coconut are expected to rise further in the wake of the white fly infestation which is spreading fast, and which has reduced the harvest. Explaining the prevailing high prices, the growers say production is leaner in November, December, January, and February. Coconut Development Authority (CDA) Chair Keerthi Weerasinghe said, White fly pest is spreading at a higher rate than we thought"". more..",https://www.sundaytimes.lk/230101/news/white-fly-infestation-set-to-drive-coconut-prices-higher-507179.html
2023,Jan,19,CT,Wild animals destroyed over 200M coconuts in 2022,"Over 200 million coconuts have been destroyed by toque macaque, monkeys and giant squirrels in 2022, a study conducted by the Hector Kobbekaduwa Agrarian Research and Training Institute revealed. According to the study, in January to June of 2022, coconut plantations have suffered the most crop damage by wildlife. While in the first six months in 2022, 93 million coconuts have been destroyed by toque monkeys, monkeys and Giant Squirrels, by the end of 2022, more..",https://ceylontoday.lk/2023/01/19/wild-animals-destroyed-over-200m-coconuts-in-2022/
2023,Feb,14,CT,National policy on coconut oil importation mooted,"All Ceylon Traditional Coconut Oil Manufacturers Association (ACTCOMA) has urged the Govt to enact a national policy for the importation of coconut oil. Minister Nalin Fernando met representatives of the ACTCOMA, to discuss the quality of coconut oil supplied to the local market. During the meeting, Fernando inquired about the market issues that local coconut oil producers are currently facing. It is difficult for the traditional small and medium scale local more..",https://ceylontoday.lk/2023/02/14/national-policy-on-coconut-oil-importation-mooted/
2023,Mar,9,MSN,Thailand's monkey labour issue could pave way for SL to boost coconut milk exports,"Sri Lanka could get the opportunity to increase the export of its coconut-based products in the near future, as international companies are moving away from procuring from Thailand- a key supplier- due the usage of monkey labour. Following investigations carried out by PETA, major retailers, including Walmart, Costco, Target and Kroger, have already stopped carrying coconut milk from certain Thai suppliers accused of using monkeys for forced labour. more..",https://www.msn.com/en-xl/news/other/thailand-s-monkey-labour-issue-could-pave-way-for-sl-to-boost-coconut-milk-exports/ar-AA18nviy
2023,Mar,14,EN,Coconut exporters see silver line after rights body criticizes Thailands monkey labour,"SLs coconut milk exporters see a rare opportunity in expanding their sales in foreign markets after an American animal rights group has urged coconut buyers to stop importing coconut milk from Thailand due to monkey labour practice. Thailand is the third largest coconut exporter in the World after Indonesia and Philippines. SL is the fourth-largest exporter of fresh and dried coconut products, including desiccated coconut, brown fiber, virgin coconut oil, and coconut water. more..",https://economynext.com/sri-lanka-coconut-exporters-see-silver-line-after-us-rights-body-criticizes-thailands-monkey-labour-115308/
2023,Apr,22,FT,"Walahanduwa estate plants 100 acres of tea, coconut, rubber and cinnamon","Walahanduwa estate in Galle recently began planting 100 acres with tea, coconut, rubber and cinnamon crops as model new crops to boost the production and livelihood of the community. The project was launched under the leadership of Industries and Plantations Minister Ramesh Pathirana and the participation of State Plantation Industries Minister Lohan Ratwatte. The initiative was a collaborative effort of many institutions under Plantation Ministry & State Plantation Corp more..",https://www.ft.lk/business/Walahanduwa-estate-plants-100-acres-of-tea-coconut-rubber-and-cinnamon/34-747592
2023,May,11,DM,Govt to amend laws to prevent coconut land fragmentation,"Cabinet nod has been granted to amend the Tea, Rubber and Coconut Estate  Act in order to restrict fragmentation of coconut lands above one acre. Minister Ramesh Pathirana on Monday sought the approval of the Cabinet of Ministers to initiate measures to limit land fragmentation by allowing only coconut lands of one acre or less to be fragmented. According to provisions of the current the Tea, Rubber and Coconut Estate Act, coconut lands below more..",https://www.dailymirror.lk/business-news/Govt-to-amend-laws-to-prevent-coconut-land-fragmentation/273-258948
2023,Jun,18,DM,Attempt to increase coconut oil price: NMCRP,"National Movement for Consumer Rights Protection (NMCRP) today claimed that a group of people who claim to be traditional coconut oil producers are paving the way to increase the price of coconut oil in the local market. NMCRP president Ranjith Withanage said currently a coconut is sold at a high price such as Rs.120 and Rs.130 in the market. ""Due to various reasons, the price of coconut is increasing in the market. Despite the rise in coconut prices, more..",https://www.dailymirror.lk/breaking_news/Attempt-to-increase-coconut-oil-price-NMCRP/108-261292
2023,Jun,28,EN,"Sri Lanka exports down 5.59% in May, apparels, coconut slip","Merchandise exports fell 5.59% in May 2023 from a year earlier to US$ 989.7 million, due to a drop in apparel, textile and coconut exports, data showed. In the first five months to May, merchandise exports fell 8.29% US$ 4,835.99 million from a year earlier. Export earnings from Apparel & Textiles fell by 14.55% from a year earlier to US$ 412.43 million in May 2023. Demand from Western nations are falling as more..",https://economynext.com/sri-lanka-exports-down-5-59-pct-in-may-apparels-coconut-slip-124655/
2023,Jul,13,AD,Video: COPE uncovers coconut auction mafia,"The Committee on Public Enterprises (COPE) has discovered that the online auctioning system for coconut harvests, introduced with the aim of demolishing the monopoly Mafia has been opposed and obstructed as a result of the agenda of the brokers. During the COPE session, the Chairman of the Coconut Development authority Roshan Perera emphasized that the reluctance was noted as a result of their preference to the practical or offline procedure. more..",https://www.adaderana.lk/news/91921/cope-uncovers-coconut-auction-mafia
2023,Jul,27,EN,"Sri Lanka to earn up to $2.3 bln from rubber, coconut, cinnamon this year: Minister","Sri Lankas key plantation crops  rubber, coconut, and cinnamon  are expected to earn an export revenue of around $2.3 billion this year, Plantation Minister Ramesh Pathirana, said.  Despite an economic and fertilizer crisis, the island nation, best known for its cinnamon and tea, earned $900 million from rubber exports after seeing a record export earning of $1.1 billion in 2021 due to higher demand for rubber-related products during Covid pandemic. more..",https://economynext.com/sri-lanka-to-earn-up-to-2-3-bln-from-rubber-coconut-cinnamon-this-year-minister-126882/
2023,Aug,3,PMD,Second Coconut Triangle to be launched in the Northern Province,"The second Coconut Triangle would be launched in the Northern Province this year consisting of the areas of Jaffna, Mannar and Mulaitvu Districts in conjunction with World Coconut Day on Sept 2, Minister Ramesh Pathirana stated. He expressed these views today (2) during a press conference themed One Year of Progress held at the Presidential Media Centre (PMC). Additionally, according to Pathirana, 290 million kg of tea are planned to be exported this year. more..",https://pmd.gov.lk/news/second-coconut-triangle-to-be-launched-in-the-northern-province-parallel-to-world-coconut-day/
2023,Aug,17,ST,Coconut.lovely coconuts,"A neighbourhood radio was blaring the song Pol.pol..pol.pol pol..polpolpol lankawe wathuwala wavena pol , a perennial favourite by baila king, the late M.S. Fernando. Inspired by this song, the trio under the margosa tree was deep in conversation about coconuts. This is how the conversation progressed: Have coconut prices come down ( Pol gedi wala mila adu welada ), asked Serapina. Not really, it is also rising like the cost of living more..",https://www.sundaytimes.lk/230813/business-times/coconut-lovely-coconuts-527532.html
2023,Sep,3,AD,"Jaffna, Mullaitivu and Mannar districts form Sri Lankas second Coconut Triangle","Jaffna, Mullaitivu and Mannar included to form SLs second Coconut Triangle Sri Lankas second Coconut Triangle was launched in the Northern Province on Saturday, in view of World Coconut Day. Accordingly, the Jaffna, Mannar and Mullaitivu districts formed the countrys second Coconut Triangle, which was officially launched at a ceremony held at the Palai Coconut Model Garden in Jaffna. SLs coconut export revenue has significantly increased in recent years. more..",https://www.adaderana.lk/news/93105/jaffna-mullaitivu-and-mannar-districts-form-sri-lankas-second-coconut-triangle
2023,,,,The Journey of a Coconut in Sri Lanka,,
2023,Nov,1,DM,Demand for Sri Lankan King Coconuts increases; exports up 117% in 2023,"With the rapid increase in demand for SL King Coconuts in the international market, their export from SL has increased by 117% in 2023, the Agriculture Ministry said. According to the SL Coconut Development Authority, the export of king coconuts from SL has increased by 117% in 2023. A discussion was held in this regard with the officers of Coconut Development Board of SL, Coconut Research Institute, and more..",https://www.dailymirror.lk/breaking-news/Demand-for-Sri-Lankan-King-Coconuts-increases-exports-up-117-in-2023/108-270384
2023,Nov,17,CT,CPA wants coconuts classified as export-oriented,"Coconut Planters Association (CPA) has urged the Minister of Agriculture and Plantation Industries to classify coconut cultivation as an export-oriented crop. Concerns were raised during a recent meeting at the Ministry of Plantation, where the association highlighted issues arising in the sector. Despite coconut exports occurring, they are not officially recognised as export-oriented. During the meeting, the association addressed coconut cultivation, export & domestic consumption. more..",https://ceylontoday.lk/2023/11/17/cpa-wants-coconuts-classified-as-export-oriented/
2023,Nov,21,DM,"Daily coconut consumption is 4.5 million, production is 3 million: Ministry","Following research conducted by the Agriculture Ministry, it has been revealed that the total daily consumption of coconuts is around 4.5 million nuts, and the daily production of coconuts is around three million nuts. Therefore, Agriculture Ministry has instructed the National Coconut Development Board to implement a programme to motivate people to cultivate coconuts in every home garden that has space. Accordingly, a large amount of coconut that can be used for consumption more..",https://www.dailymirror.lk/breaking-news/Daily-coconut-consumption-is-4-5-million-production-is-3-million-Ministry/108-271723
2023,Dec,4,EN,Haycarb begins coconut growing campaign in North,"SLs Haycarb Plc, an exporter of activated carbon said it had begun a campaign to expand coconut cultivation in the north of the island. This is being done in partnership with the Coconut Development Authority and Coconut Cultivation Board. Haycarb aims to plant 100,000 coconut trees in the Northern regions of Sri Lanka, including Mullaitivu, Kilinochchi, and Jaffna. This initiative is a vital part of a broader national endeavour to establish a second coconut triangle, more..",https://economynext.com/sri-lankas-haycarb-begins-coconut-growing-campaign-in-north-142470/
2023,Dec,12,ST,"Corruption, taxes, disease and imports crushing coconut industry","SLs coconut industry is facing a grave crisis as its access to the global market receives little or no support from the state. Beset by political interference and corruption, its survival is in danger, with production and productivity on the decline. The high cost of raw materials and production has caused a once-thriving industry to falter over the years. The coconut sector is now left out of state patronage with no subsidy more..",https://www.sundaytimes.lk/231210/news/corruption-taxes-disease-and-imports-crushing-coconut-industry-541808.html
2023,Dec,15,EN,"Global demand for Sri Lankas king coconut, govt plans branding","Amidst global demand for the king coconut grown in Sri Lanka, the Ministry of Agriculture and Plantation Industries is now taking steps to cultivate it as an export crop. There is demand in the United Arab Emirates for king coconut from Sri Lanka. 200 containers of king coconuts are exported to the country a month, Minister of Agriculture, Mahinda Amaraweera has said. A king coconut from SL sells for the equivalent of 2,500 rupees in the UAE coastal regions, more..",https://economynext.com/global-demand-for-sri-lankas-king-coconut-government-plans-branding-143982/
2023,Dec,16,FT,SL to assist coconut cultivation in Cuba,A meeting between PM Dinesh Gunawardena and Cuban Ambassador Andres Marcelo Gonzales Garrido took place at the Temple Trees in Colombo. PM thanked Cuba for the consistent support extended to SL at the UN and other int'l forums. He also referred to the assistance given to SL to combat the dengue pandemic and stressed the need for continuous cooperation in the field of medicine. Ambassador agreed to share Cuban expertise in mosquito eradication more..,https://www.ft.lk/business/Sri-Lanka-to-assist-coconut-cultivation-in-Cuba/34-756391
2023,Dec,23,ST,Coconut industry in a soup: Tree of life has becomelazy mans cropin Sri Lanka,"The coconut industry in SL lacks foreign direct investment, financial assistance and is subject to poor estate management  all matters that need to be addressed if productivity is to be improved. The coconut tree is known as the Tree of life due to its versatile uses, but it is also considered the lazy mans crop since in most cases, farmers especially, smallholders, just watch and wait for the produce. more..",https://www.sundaytimes.lk/231217/news/coconut-industry-in-a-soup-tree-of-life-has-become-lazy-mans-crop-in-sri-lanka-542500.html
2024,Jan,1,TM,Coconut cultivation: Govt aims for 5 billion nuts by 2026,A special programme has been launched by the Ministry of Agriculture to increase the annual production of coconuts by one billion nuts in the next three years to make the total production of coconuts five billion. Minister Mahinda Amaraweera said that a special programme had been launched to increase the local coconut production by the said number during the course of the next three years.  Ministrys Media Director Dharma Wanninayake said that it had been planned to increase more..,https://www.themorning.lk/articles/nWwQ4vfa5V7W3jb3bBFU
2024,Jan,3,TM,SLs coconuts unable to meet global demand,"SL would be unable to meet the global demand of coconuts due to high cost on fertiliser resulting in a low yield in the country.  Coconut Research Institute of SL (CRISL) Director Dr. Sanathanie Ranasinghe said: The State-owned estates are applying the fertiliser, but out of  80% of the coconut growers are small growers who are reluctant to apply fertiliser due to the high cost. From Jan to Oct last year (2023), the coconut export revenue has reduced by 19% more..",https://www.themorning.lk/articles/X9Vtw6fYjAEqBrDkVBtz
2024,Jan,13,Island,Plans underway to protect coconut plantations from El Nino climate change...,"The govt has allocated Rs. 300 million to programs aimed at saving local coconut plantations from the El Nino climate impact, while 360,000 coconut saplings are also in the process of being planted, a senior official of the Ministry of Agriculture & Plantation Industries said. The prediction made by the Meteorological Dept as well as the international weather departments is that the current El Nino climate situation may further develop in the upcoming Yala season this year. more..",https://island.lk/plans-underway-to-protect-coconut-plantations-from-el-nino-climate-change-impact/
2024,Jan,24,DN,Breakthrough coconut sapling from tissue culture developed in Lunuwila,"In a scientific breakthrough, research conducted by the Lunuwila Coconut Research Institute (CRI) on developing a coconut sapling using tissue from the unopened female flower of the coconut flower has been successful. Lunuwila CRI Director Dr. Sanathani Ranasinghe said that the research carried out by the CRI on the preparation of coconut seedlings using tissue In a scientific breakthrough, research conducted by the Lunuwila CRI on developing a coconut sapling more..",https://www.dailynews.lk/2024/01/24/local/363618/breakthrough-coconut-sapling-from-tissue-culture-developed-in-lunuwila/
2024,Feb,4,ST,From waste to wardrobe: SLINTECs king coconut natural dye launched,"In a world dominated by the artificial and the synthetic, a humble hero emerged from the depths of SL. The king coconut husks, once discarded as mere waste, seized the moment to redefine its role in the fight against synthetic substitutes. Zeroing in on the king coconut husks cast aside without a second thought, it was SL Institute of Nanotechnology (SLINTEC),  first Public Private Partnership focusing on research and nanotechnology that breathed life into more..",https://www.sundaytimes.lk/240204/business-times/from-waste-to-wardrobe-slintecs-king-coconut-natural-dye-launched-546886.html
2024,Feb,6,ST,Was old man Lanka scraping coconuts for 76 years of life?,"For the last 76 years, we have been celebrating an independence won in Indias pain, with the prospect, as these last seven decades of being the sole masters of our fate have amply shown, of perishing in our own. Todays celebrations will be no different from the ones annually staged for the last three quarters of a century.  The national flag will be raised, the national anthem will be sung, a few pieces of outdated military hardware, belonging to the worlds 18th largest army, more..",https://www.sundaytimes.lk/240204/columns/was-old-man-lanka-scraping-coconuts-for-76-years-of-life-547221.html
2024,Feb,12,ST,VAT 18 shutting down SLs coconut industry,"In just a few weeks since the newly imposed 18% VAT, the coconut industry in Sri Lanka is right now in dire straits as oil millers have slowed down operations to about a few days a week resulting in over 50,000 workers losing jobs. Even punnakku is liable for VAT! For an industry that was exempted from taxes, about three weeks ago coconut oil millers in the medium and large scale sector have been asking workers to report to work for only about three days a week. more..",https://www.sundaytimes.lk/240211/business-times/vat-18-shutting-down-sri-lankas-coconut-industry-548052.html
2024,Feb,16,EN,"Rubber workers get certified, coconut pluckers and toddy tappers to follow","SLs National Apprentice and Industrial Training Authority is working with the Ministry of Agriculture and Plantation Industry to upskill informal sector workers in the country. 169 rubber workers, or those who harvest the sap, were awarded NVQ-3 certificates by NAITA in a first for the country, on Thursday (15) at the Agalawatta Rubber Research Institute. Today these rubber harvesters were given nationally and internationally recognised competency certificates. more..",https://economynext.com/sri-lankas-rubber-workers-get-certified-coconut-pluckers-and-toddy-tappers-to-follow-151178/
2024,Feb,20,ST,SLINTECs coconut husk natural dye to restyle textile industry,"SL Institute of Nanotechnology (SLINTEC) is set to revolutionise the textile industry with its latest breakthrough  a natural dye from coconut husks, with an estimated value of nearly US$50 million after commercialisation. This innovative development comes on the heels of SLINTECs successful creation of a natural dye from king coconut husks, known as Kingco. Officials said that currently the bulk testing on this latest natural coconut husk dye is being conducted for more..",https://www.sundaytimes.lk/240218/business-times/slintecs-coconut-husk-natural-dye-to-restyle-textile-industry-548887.html
2024,Feb,26,TM,"Sri Lanka exporters to maintain king coconut prices at Rs 2,000","Minister Mahinda Amaraweera stated that in a move to bolster SL's position as a leading exporter of king coconuts, exporters have agreed to uphold prices at 2000 rupees per fruit. Accordingly, the decision came amidst plans to expand king coconut cultivation, with the inauguration of the second king coconut cultivation village near Murutawela Raluwa village. The initiative aims to meet the growing demand for SL king coconuts, particularly in UAE & other int'l markets. more..",https://www.themorning.lk/articles/ds2hF5tZkMoOx8u3GubZ
2024,Mar,4,CT,High coconut prices see increase in restaurant food cost,"Due to the significant rise in coconut prices, an essential ingredient for preparing sweets for the upcoming Sinhala and Tamil New Year festival, All-Ceylon Restaurant Owners Association (ACROA) has forecasted a substantial increase in the price of coconut oil. ACROA President Harshana Rukshan emphasised the need to adjust food packet prices due to the rapid surge in coconut prices. He highlighted the current cost of a normal-sized coconut has skyrocketed from Rs 60 to 80 more..",https://ceylontoday.lk/2024/03/04/high-coconut-prices-see-increase-in-restaurant-food-cost/
2024,Mar,24,ST,"Lack of inputs, policy bungling contribute to volatile price of coconuts and oil","The scarcity of coconuts in Sri Lanka, mainly due to a lack of fertiliser, will probably reduce supply and push up prices further. As most curries use coconut milk, the rapidly rising prices will have a significant impact on prepackaged rice and curry meals, consumer and civil rights activist Asela Sampath believes. People will switch to alternatives or cook without coconut oil, he predicts. Non-communicable diseases could increase. more..",https://www.sundaytimes.lk/240317/news/lack-of-inputs-policy-bungling-contribute-to-volatile-price-of-coconuts-and-oil-551616.html
2024,Mar,26,DM,"Rs. 3,439 million earned by exporting coconut water","An income of Rs. 3,439 million was earned in February this year by exporting coconut water from SL, Coconut Development Authority (CDA) said. According to the data from the CDA, the amount earned by exporting coconut water in Feb 2023 is Rs. 2,705 million. There has been an increase in export income of Rs. 734 million by the pre-spring months of this year compared to last year, CDA Chairman Professor Roshan Perera said. These facts were revealed during more..",https://www.dailymirror.lk/breaking-news/Rs-3-439-million-earned-by-exporting-coconut-water/108-279575
2024,Mar,27,DN,85 villages selected to cultivate king coconut,"Ministry of Agriculture and Plantation Industries has selected 85 villages in SL as king coconut cultivation model villages for export oriented. 50,000 king coconut saplings are to be planted in these 85 villages this year and Homagama Dampe village has been chosen as the first king coconut cultivation model village in Colombo district. Accordingly, distribution of king coconut saplings to 100 farm families of Dhampe village took place today at more..",https://www.dailynews.lk/2024/03/27/admin-catagories/breaking-news/469149/85-villages-selected-to-cultivate-king-coconut/
2024,Apr,12,ST,Hot weather brings bad news of white fly infestation in coconut trees,"Agrarian authorities have introduced a biological control agent to curb white fly infestations in coconut trees, which have been made worse by the prevailing heat that creates a conducive environment for the infestation. The biological control agent, Encarsia guadeloupe, one of the parasitoid species, was applied in both forms (live and eggs) to small scale coconut farms as a pilot project in several regions of the Northern Province. Thevarajah Vaigunthan, Regional Head of more..",https://www.sundaytimes.lk/240407/news/hot-weather-brings-bad-news-of-white-fly-infestation-in-coconut-trees-554058.html
2024,Jun,11,FT,"Parliamentary Committee pushes for removal of barriers in toddy, kithul, palm, coconut...","In an effort to boost agricultural exports, the Sectoral Oversight Committee on National Economic and Physical Plans has instructed relevant officials to eliminate obstacles in the local production and export of toddy, kithul, palm and coconut-related products. This directive came during a recent meeting chaired by Committee Chairman and MP Mahindananda Aluthgamage. Key Govt institutions, including the Excise Department and the Customs Dept, more..",https://www.ft.lk/front-page/Parliamentary-Committee-pushes-for-removal-of-barriers-in-toddy-kithul-palm-coconut-products/44-762919
