Year,Month,Day,Source,Title,Body,Link
2020,Oct,7,Island,"Due to environmental concerns govt to ditch oil palm cultivation in favour of coconut,...","The govt would halt the cultivation of oil palm in the country an extent of 10,579 hectares of land already planted with oil palm would be used to grow coconut and rubber, Parliament was told yesterday. Answering a question from Kandy District SJB MP Velu Kumar, Plantations Minister Ramesh Pathirana said there were few cases pending before courts with regard to palm oil industry, preventing the govt from stopping oil palm cultivation identified as a threat to the environment. more..",https://island.lk/due-to-environmental-concerns-govt-to-ditch-oil-palm-cultivation-in-favour-of-coconut-rubber/
2020,Oct,9,CT,Mixing palm oil with coconut oil: Racket about to resume: NMCRP,"The National Movement for Consumer Rights Protection (NMCRP) said the business of mixing palm oil with coconut oil is about to resume, to please a henchman of a Minister. According to a decision of the Govt, palm oil is taxed higher than coconut oil when it is imported. Laws have also been enacted to prevent the mixing of coconut oil and palm oil. The large-scale racket of mixing palm oil with coconut oil has been active throughout the country over the past few decades, more..",https://ceylontoday.lk/news/mixing-palm-oil-with-coconut-oil-racket-about-to-resume-nmcrp
2020,Oct,15,EN,"Sri Lanka suspends coconut auctions, amid rising retail prices","Sri Lanka has suspended weekly auctions conducted by the state Coconut Development Authority amid rising domestic retail prices. So far no decision had been made on re-starting the auction. Average auction prices hit 56,494 at the last auction with the top price hitting 61 rupees. Sri Lankas price control agency the Consumer Affairs Authority slapped price controls creating shortages in the market. more..",https://economynext.com/sri-lanka-suspends-coconut-auctions-amid-rising-retail-prices-74797/
2020,Oct,19,FT,Harry J decries step-motherly treatment to coconut arrack industry,Distilleries Company of SL (DCSL) Chairman and business leader Harry Jayawardena has decried what he called as step-motherly treatment to the coconut arrack industry and warned of serious health and tax revenue issues if the Govt fails to urgently address measures to nab the thriving illegal and illicit liquor industry. The plight of the legitimate industry players paying taxes and complying with other requirements more..,http://www.ft.lk/front-page/Harry-J-decries-step-motherly-treatment-to-coconut-arrack-industry/44-707711
2020,Oct,24,ST,"5,000 Puttalam District coconut trees destroyed by intruding elephants","A herd of elephants tore through a village in the Puttalam district this week and caused damage to crops and coconut plantation, Divisional Secretary Dulanka Athukorala said. She said more than 400 coconut trees were damaged by the wild elephants at Sembukuliya in the Mahakumbukkadawala area in what she described as a serious escalation in the human-elephant conflict. So far 20 acres of coconut plantation had been destroyed in the area due to more..",http://www.sundaytimes.lk/201018/news/5000-puttalam-district-coconut-trees-destroyed-by-intruding-elephants-420409.html
2020,Oct,29,ST,Now; coconut oil is bad for your heart,"The fat is well and truly in the fire. Over the years, coconut oil has been swirled and twirled in controversy..it is bad for your health, we were told many years ago, and more recently, it is very good for your health. The lid has finally been blown off the miracle that is coconut oil by a local team of experts who have pored over scientific publications, in a literature review to reveal fact from fiction. more..",http://www.sundaytimes.lk/201025/news/now-coconut-oil-is-bad-for-your-heart-421138.html
2020,Nov,2,FT,"Where have all the coconuts gone? Surely, not out of the country?","Fresh coconuts have disappeared from most of the retail outlets in the country by last week. In some places, they are available but sold through the backdoor as if the traders are dealing in contraband. Worse, they are sold at prices ranging from Rs. 100 to 120 per nut. That is close to double the price set by the Govt for average sized coconuts.  But the customers are treated to a double jeopardy here. Apart from the high prices, they get partly mature coconuts plucked before they reach more..",http://www.ft.lk/columns/Where-have-all-the-coconuts-gone-Surely-not-out-of-the-country/4-708299
2020,Nov,15,Island,Real coconut arrack may soon become history warns Harry J,"Distilleries Company boss Harry Jayawardena has warned that real coconut arrack will soon be out of the market if the concerned authorities do not look into the step-motherly treatment now being accorded to the coconut arrack industry. Jayawardena, Chairman of Distilleries Company of SL (DCSL) has sounded this warning in the recently published annual report of the company where he has complained about prevailing exorbitant pricing structure of coconut arrack more..",https://island.lk/real-coconut-arrack-may-soon-become-history-warns-harry-j/
2020,Nov,29,ST,Coconut industry undergoes structural reforms,"SLs coconut industry is to undergo structural reforms harnessing the economic potential with incentives provided in the Budget 2021. The four existing institutions related to coconut industry will amalgamated to form a single entity as the Coconut Cultivation & Allied Industries Development Authority under an integrated institutional structure. This will be a key reform in the industry with the merging of Coconut Development Authority (CDA), Coconut Research Institute (CRI), more..",http://www.sundaytimes.lk/201129/business-times/coconut-industry-undergoes-structural-reforms-423695.html
2020,Dec,7,CT,'No sand mining on Coconut lands',"Minister  Mahinda Amaraweera instructed officials of the Geological Survey and Mines Bureau (GSMB) to suspend issuing sand mining licences, where the mining is conducted in coconut lands. In the backdrop of the Consultative Committee meeting of the Ministry of Environment in Parliament on 4 Nov it was revealed that sand mining in coconut lands has caused severe environmental damage and reduced coconut yields. It was also emphasised that sand mining & extractions in coconut more..",https://ceylontoday.lk/news/no-sand-mining-on-coconut-lands-amaraweera
2020,Dec,26,EN,Sri Lanka dried coconut slice imports made state monopoly,"Sri Lanka is allowing the import of coconut dried coconut slices with the seed coat for domestic processing, under a state monopoly, the state information office said amid higher domestic prices for coconut. The import which will months will be a monopoly of the state-run British Ceylon Corporation (BCC). BCC is one of a series of firms that were expropriated by native rulers after self-determination in 1948, undermining property rights and ratcheting up regime uncertainty. more..",https://economynext.com/sri-lanka-dried-coconut-slice-imports-made-state-monopoly-77268/
2020,Dec,31,TM,Coconut oil: Confusion over tax concessions,"Concerns have been raised over the confusion created by  Ministry of Finance while amending the Special Commodity Levy imposed on imported coconut oil. It is alleged that the Govt had created the confusion in order to give benefits to a private company importing coconut oil into the country, while causing a huge loss to the Govt. Earlier, allegations had also been levelled against the Govt for letting a pvt company, more..",http://www.themorning.lk/coconut-oil-confusion-over-tax-concessions/
2021,Jan,12,AD,Cabinet nod to import frozen coconut kernels,"As a result of local coconut production supply being insufficient for industries related to coconut kernel, Cabinet had approved the import of coconut kernel in 2017. Accordingly, 2,542 metric tons of coconut kernels were imported to SL during a period of 08 months. Meanwhile, it has been estimated a shortage of 250 million coconuts for the year 2021. Therefore, the Cabinet of Ministers has granted consent to take necessary measures for importing coconut kernel for more..",http://www.adaderana.lk/news/70696/cabinet-nod-to-import-frozen-coconut-kernels
2021,Jan,14,CT,Fragmentation of coconut land cant be stopped: Johnston,"Minister Johnston Fernando said, instead of banning large- scale coconut land fragmentation, it would be more appropriate to give land clearing companies the opportunity to start new coconut plantations and take care of them at least for a period of three years. He was responding to a question raised by a journalist regarding the fragmentation of coconut land in the Kurunegala District. He also said, although cutting down coconut trees has been heard for the past 20 years, more..",https://ceylontoday.lk/news/fragmentation-of-coconut-land-can-t-be-stopped-johnston
2021,Feb,26,DN,Ceylinco Insurance introduces Insurance for Coconut growers,"Sri Lanka Coconut Cultivators Association and the Ceylinco Insurance Company (CIC) under the guidance of the Coconut Development Authority (CDA) jointly launched a special Insurance scheme for the sector, which is a first for Sri Lanka. Under this novel insurance program Ceylinco Insurance proposes to compensate and provide a sustainable insurance solution to coconut cultivators on behalf of damages caused in various ways to their cultivations. more..",http://www.dailynews.lk/2021/02/26/business/242538/ceylinco-insurance-introduces-insurance-coconut-growers
2021,Mar,13,NR,SJB reveal details of a coconut oil fraud,"SJB claims the company charged over the alleged sugar tax fraud is also involved in fraud related to the importation of coconut oil. MP Champika Ranawaka said the Ministry of Finance issued a special Gazette notification in July 2020, drastically reducing the tax imposed on the importation of coconut oil. MP said thereafter the relevant company had imported a large stock of coconut oil adding however that the price of coconut oil did not decrease in the local market. more..",https://www.newsradio.lk/justin/sjb-reveal-details-of-a-coconut-oil-fraud/
2021,Mar,16,NR,Decisions to be reached over coconut estates,"The govt has directed attention towards reaching several decisions related to coconut plantations, including banning cutting coconut trees.  Minister of Plantation Ramesh Pathirana said the decision will be implemented within the year. Accordingly, coconut trees will be included in the Felling of Trees (Control) Act and necessary laws are being formulated. Under the Felling of Trees (Control) Act special permission must be obtained to cut jackfruit, breadfruit and palm trees. more..",https://www.newsradio.lk/local/several-decisions-to-be-reached-over-coconut-estates/
2021,,,,Video: SLSI responds to allegations over unhealthy coconut oil,"Mar 26  (AD)  SL Standards Institution (SLSI) today rejected as totally fabricated and false the allegations in the media and social media claiming that senior officials of the SLSI had authorized the sale of unhealthy coconut oil imported to the country by four importers.  SLSI, being the standards body for quality to the nation, will not compromise the set standards for any commodity or material that will be detrimental to the lives and livelihoods of more..",http://www.adaderana.lk/news/72593/slsi-responds-to-allegations-over-unhealthy-coconut-oil
2021,Mar,27,DM,"'Import of unrefined, carcinogenic coconut oil: Stern action against culprits'","Strict legal action will be taken against those who imported unrefined coconut oil that contained carcinogens, Trade Minister Bandula Gunawardena said yesterday in Parliament. He added that no political intervention will be allowed when the culprits are brought to book. He observed that there has been a request made to carry out an investigation on the matter by the CID. more..",http://www.dailynews.lk/2021/03/27/local/245106/stern-action-against-culprits-trade-minister
2021,Mar,28,Island,13 containers of imported coconut oil under laboratory investigation for toxic substances,"Amidst allegations that consignments of contaminated coconut oil imported to the country have been cleared for release to the market by the SL Standards Institution (SLSI), the head of the premier body dismissed the claims as unfounded , saying that samples of the 13 containers are still under testing for any harmful substances. The laboratory investigation is continuing and it will take another two days for the process to more..",https://island.lk/13-containers-of-imported-coconut-oil-under-laboratory-investigation-for-toxic-substances/
2021,Mar,29,Island,Second test confirms shipment of coconut oil contaminated,"Aflatoxins could be more carcinogenic to children than adults, Senior Professor Arjuna de Silva said, warning that the impact of aflatoxin contaminated coconut oil would have disastrous consequences. Aflatoxins usually affect the kidneys and can eventually lead to cancers there. This might affect children more. Even their growth can be affected if they are exposed to this for a long time or a sudden large dose, he said, more..",https://island.lk/second-test-confirms-shipment-of-coconut-oil-contaminated/
2021,Mar,29,TM,'Impure coconut oil widespread in Sri Lanka',"The issue of adulterated oil being passed off as coconut oil is widespread in SL, and it is undermining public health, according to a senior Ministry of Health official. Food Safety Unit of the Health Ministry Director Dr. Thilak Siriwardana said the coconut oil industry is at a stage where it needs rapid correction. Some importers bring crude coconut oil containing aflatoxin, which is harmful to the human body. more..",https://www.themorning.lk/impure-coconut-oil-widespread-in-sl-health-ministry/
2021,Mar,29,AD,Video: Unrefined coconut oil imported by 3 companies fail second test,"It has been reconfirmed through tests that the unrefined coconut oil stocks, imported to SL by 3 companies, contain the carcinogen Aflatoxin, SL Standards Institution (SLSI) stated. SLSI, Food Safety Unit of the Ministry of Health, and Industrial Technology Institute (ITI) re-tested the samples of imported unrefined coconut oil, based on appeals by the importing companies. However, the test results released today reconfirmed that more..",http://www.adaderana.lk/news/72660/unrefined-coconut-oil-imported-by-3-companies-fail-second-test
2021,Mar,30,TM,Aflatoxins in coconut oil: A scandal that can boil over,"Sinhala & Tamil New Year is just around the corner, and compared with last year, this years Covid-19 situation is rather stable or normalised, and gives the people a chance to move about with far more freedom.  However, last week, allegations were levelled against SL Customs that it had released a container of coconut oil to imports despite the quality tests suggesting that the oil contains a carcinogen known as aflatoxins. more..",https://www.themorning.lk/aflatoxins-in-coconut-oil-a-scandal-that-can-boil-over/
2021,Mar,30,FT,"Customs orders 1,800 tons of coconut oil be re-exported","The Customs Department has informed the importers of 1,800,000 kg of coconut oil, to re-export the stock after a second round of tests by the SL Standards Institute (SLSI) found samples of the consignment to be unfit for consumption. Customs Director General Maj. Gen. (Rtd) Vijitha Ravipriya, said that the decision had been made to ensure public trust in local market products was maintained. more..",http://www.ft.lk/front-page/Customs-orders-1-800-tons-of-coconut-oil-be-re-exported/44-715503
2021,Mar,30,AD,Video: Police seize two bowsers containing disputed coconut oil,"Two bowser trucks containing coconut oil stocks, which were sealed by SL Customs on suspicion of containing carcinogenic substances, have been seized by the Dankotuwa Police. The raid was carried out on Monday night following a tip-off received through the 119 hotline. Thereby, 27,500 litres of coconut oil have been taken into custody by the investigating officers. The bowser trucks were found while parked at more..",http://www.adaderana.lk/news/72682/police-seize-two-bowsers-containing-disputed-coconut-oil
2021,Mar,30,EN,Customs to determine whether contaminated coconut oil entered market,"Sri Lanka Customs has opened an investigation to determine whether any coconut oil contaminated with high levels of aflatoxin, a carcinogenic substance, has been released to the market, Minister Ramesh Pathirana said. Customs is looking to find the perpetrators and, once the reports are out, we will take legal action against them, Pathirana told reporters at the weekly cabinet press briefing today. The govt is determined to take legal action against those involved, he said. more..",https://economynext.com/sri-lanka-customs-to-determine-whether-contaminated-coconut-oil-entered-market-80262/
2021,Mar,30,NR,Dont cover sugar scam with coconut oil issue,SJB MP JC Alawathuwala says they will not let the govt coverup the sugar tax scam owing to the prevalent coconut oil controversy. MP Alawathuwala questioned the govt over what measures have been taken against those responsible for the sugar scam especially with numerous complaints having been lodged over the matter. He questioned if the govt has begun deliberating the complaints that have been received over the sugar tax scam. more..,https://www.newsradio.lk/local/dont-coverup-sugar-scam-with-coconut-oil-dilemma/
2021,Mar,31,Island,Aflatoxin in imported coconut oil,"The public are bombarded with half truths on presence and release of imported aflatoxin-contaminated coconut oil to the market. When improperly dried copra is stored for many days a mold of yellow colour, which becomes moss green later, appears on the surface of the kernels, releasing aflatoxins deep into the coconut kernels. Once released into the kernel, the toxin remains unchanged till the kernel disintegrates. On expulsion of oil from such copra, 80% of aflatoxin more..",https://island.lk/aflatoxin-in-imported-coconut-oil/
2021,Mar,31,FT,SJB calls for suspension of bulk coconut oil imports,"The SJB called on the Govt to suspend bulk imports of coconut oil and to carry out random tests of existing stocks in the market to reassure the public of food safety. The call came after aflatoxin, a carcinogenic chemical was detected in several import stocks of coconut oil, prompting customs to direct the importers to re-export the stock. SJB MP Dr. Harsha de Silva called on the Govt to temporarily halt the import of more..",http://www.ft.lk/news/SJB-calls-for-suspension-of-bulk-coconut-oil-imports/56-715624
2021,Apr,1,CT,To boost local production of coconut oil: Plans underway to import dehydrated kernel,"The Govt has decided to import dehydrated coconut kernel to encourage local production of coconut oil.  Director-Operations of the Coconut Development Authority, Operations, Piyasena Edirimanne said the proposal has received Cabinet approval and tenders will be called soon after the technical committee report. Accordingly, dehydrated crude coconut will be imported in the future from countries such as India, Indonesia, Vietnam and the Philippines and more..",https://ceylontoday.lk/news/to-boost-local-production-of-coconut-oil-plans-underway-to-import-dehydrated-kernel
2021,Apr,1,EN,Customs checking for leaks of coconut oil with aflatoxin,"Sri Lanka Customs is deploying a separate team to check whether coconut oil with higher that permitted levels of aflatoxin, which have been taken out of the port is re-exported in its entirety, Director General of Customs Vijitha Ravipriya said. We are checking in companies storages as well to check whether they have the same quantity we released from the customs, Ravipriya, a retired military Major General told reporters. more..",https://economynext.com/sri-lanka-customs-checking-for-leaks-of-coconut-oil-with-aflatoxin-80345/
2021,Apr,2,AD,Video: Third round of tests reconfirm Aflatoxin in unrefined coconut oil stock,"The third round of tests has reconfirmed that the unrefined coconut oil consignment, imported by three private companies and stored in their warehouses, contains the highly carcinogenic substance called Aflatoxin. State Minister of Consumer Protection Lasantha Alagiyawanna said the relevant importing companies have already been informed to re-export the coconut oil stocks in question without delay. Recent tests carried out by the SL Standards Institute (SLSI) and more..",http://www.adaderana.lk/news/72764/third-round-of-tests-reconfirm-aflatoxin-in-unrefined-coconut-oil-stock
2021,Apr,4,SO,SME coconut-based industries in dire straits,"Calling on the authorities to protect the small and medium sector coconut based industries which are in dire straits due to foreign factory operators of coconut-based products, the Consortium of Coconut Based Producers and Exporters of Ceylon (COCOPEC) called upon the policy makers to set up a vibrant force to ensure the sustenance of SMEs of the industry. COCOPEC President Upali Weerakoon said what is distressing is foreigners who initially patronised SL more..",http://www.sundayobserver.lk/2021/04/04/business/task-force-protect-industrialists-vital-cocopec-president
2021,Apr,4,Island,Contaminated coconut oil: CID questions five persons linked to importers,"The CID has begun interrogating five persons linked to the three importers of contaminated coconut oil in a bid to get to the bottom of what is suspected to be a big time racket, which had continued for a considerable period of time. Police said the phone records of the suspects will be checked to ascertain whether any others were also involved in the racket to inject cheap imported coconut oil with a high concentration of carcinogenic aflatoxins into the market. more..",https://island.lk/contaminated-coconut-oil-cid-questions-five-persons-linked-to-importers/
2021,Apr,5,ST,"After the sugar scam, now toxic-hit coconut oil scare","Even before the 16 billion buck sugar scam had melted on the public tongue, the spectre of a horrific health scare has now risen to envelop the peoples wellbeing in a toxic shroud. The sugar scam had blown a gaping hole in the public coffers, skimming an estimated Rs. 16 billion from the Treasury vaults. The scam had been confirmed officially when the Finance Ministry report to Parliament last month blew the lid on what may become the financial fiddle of the decade, more..",http://www.sundaytimes.lk/210404/columns/after-the-sugar-scam-now-toxic-hit-coconut-oil-scare-438862.html
2021,Apr,5,TM,'Must increase coconut production by three billion nuts',There has been great concern among SL consumers over the past few days following the detection of substandard coconut oil containing a carcinogenic named aflatoxins and a full-blown investigation being launched into the matter. The Morning spoke to State Minister  Arundika Fernando to inquire into this issue and to understand what plans are in place to develop the coconut industry. Fernando is currently more..,https://www.themorning.lk/must-increase-coconut-production-by-three-billion-nuts/
2021,Apr,5,AD,One importer set to re-export coconut oil stocks containing Aflatoxin,"All measures have been set in place to re-export the coconut oil stocks of one of the three companies that imported unrefined coconut oil containing carcinogens. The relevant coconut oil stocks of Katana Refineries will be re-exported within this week. It was recently revealed that stocks of unrefined coconut oil imported by 03 companies - Ali Brothers, Edirisinghe Edible Oil,  and Katana Refineries - contained more..",http://www.adaderana.lk/news/72828/one-importer-set-to-re-export-coconut-oil-stocks-containing-aflatoxin
2021,Apr,8,CT,Carcinogens in Coconut Oil,"Coconut oil has been used in Sri Lanka replacing sesame oil after the population drifted to the South-West following the invasion of Raja Rata by Kalinga Magha in 1215. Initially it was made in homes using fresh scraped coconut. This practice was continued well into the latter half of the last century. It is the fungus contained, in not properly dried coconut kernel called copra used for the extraction of coconut oil on a mass-scale in oil mills which contains the carcinogenic aflatoxin. more..",https://ceylontoday.lk/news/carcinogens-in-coconut-oil
2021,Apr,8,AD,Video: Tests confirm Aflatoxin presence in samples from coconut oil bowsers,"Tests carried out on samples from the two bowser trucks containing coconut oil  which were recently taken into custody at Dankotuwa  have indicated the presence of Aflatoxin. The two bowser trucks were seized by Dankotuwa Police on the 30th of March, on suspicion of containing carcinogenic substances. A total of 27,500 liters of coconut oil had been taken into custody from the two bowser trucks more..",http://www.adaderana.lk/news/72909/tests-confirm-aflatoxin-presence-in-samples-from-coconut-oil-bowsers-
2021,Apr,10,ST,When contaminated coconut oil seeps through system loopholes,"As the controversy over harmful coconut oil stocks continued, yesterday the authorities said they were unable to confirm whether the contaminated oil had reached the consumers.  Customs, Public Health Inspectors & Food Control Admin. Unit (FCAU) of the Health Ministry said a string of investigations were underway into the import and could take time as they were to ascertain whether harmful oil had entered the markets. more..",http://www.sundaytimes.lk/210404/news/when-contaminated-coconut-oil-seeps-through-system-loopholes-438995.html
