Year,Month,Day,Source,Title,Body,Link
2013,Jan,15,GDI,2000 coconut seedlings among 2000 families,"The 521 Brigade of Point Pedro launched a livelihood project in Nagar Kovil, Ampan, Kudaththane and Potpathy Grama Niladhari Divisions in Vadamaratchi distributing coconut seedlings to improve the economy of newly resettled people in those areas. In the project launched under the Civil Military Coordination (CIMIC) programme initiated by the Commander Security Forces Jaffna (SF-J) Major General Mahinda Hathurusinghe, 2000 coconut seedlings were given to 340 families. more..",http://www.news.lk/news/sri-lanka/4132-2000-coconut-seedlings-among-2000-families
2013,Feb,7,LT,Student steals coconuts to find money to paint her school,"A 13 year old student has been brought before Court on charges of stealing coconuts to find funds to paint the buildings of the school she is having her education at. She has stolen coconuts as she was unable to find the Rs.800 her school authorities had asked each student to find to raise a fund to paint the buildings. When she was caught she had in her possession 8 coconuts worth Rs.300. The lawyers Thushara Gunaratne and Roshan Dehiwela, who appeared on behalf of more..",http://www.lankatruth.com/english/index.php?option=com_content&view=article&id=4342:student-steals-coconuts-to-find-money-to-paint-her-school-&catid=42:smartphones&Itemid=74
2013,Feb,8,DN,Stealing coconuts to pay for school painting: President orders probe,"President Mahinda Rajapaksa ordered an urgent and special inquiry into the incident where a 13  year - old student in Horana robbed coconuts to pay Rs 800 to school authorities to paint the school, Minister Keheliya Rambukwella said.  He said this incident was extensively discussed during the Cabinet meeting yesterday morning, adding that the President spoke emotionally about the incident, while noting the abhorrent facts related to it. more..",http://www.dailynews.lk/2013/02/08/news02.asp
2013,Feb,10,Island,Editorial : Eight coconuts and a 13-year old,"Last weeks horror story of the 13-year old girl hauled before a magistrate for picking eight fallen coconuts from a neighbours garden grabbed front page space in national newspapers and the electronic media and shocked the conscience of the nation. The only saving grace was that two lawyers from a provincial bar appeared for the child pro deo. What is particularly galling is that the reason for the child helping herself to the coconuts fallen from a kalpa ruksha, more..",http://www.island.lk/index.php?page_cat=news-section&page=news-section&code_title=69
2013,Feb,11,Island,Schooling: Picking and plucking coconuts,"Education Minister Bandula Gunawardena got into hot water a few moons ago for claiming that a family of three could live on a monthly income of Rs. 7,500 if the home economy was frugally managed. He, true to form, flew in the face of common sense in a futile bid to prove his point and cut a very pathetic figure in the process. Today, it has become patently clear that when he plucked that figure out of the air he chose to ignore at least the cost of free education more..",http://www.island.lk/index.php?page_cat=news-section&page=news-section&code_title=55
2013,Feb,14,DN,CAA raids coconut oil selling centres in Pettah,"Consumer Affairs Authority (CAA) officials yesterday raided coconut oil selling centres in Pettah to investigate the complaint that coconut oil was mixed with palm oil by the sellers as the price of palm oil was significantly low in the market. The CAA officials collected the samples from all selling centres and directed them to the laboratory of the Coconut Development Authority to verify whether the consumer protection laws of the country are violated. ""If found guilty, stern action will be more..",http://www.dailynews.lk/2013/02/14/news22.asp
2013,Feb,19,DM,"Coconuts, courts and cultural concoction","The President, an exceedingly nice man, has been moved by the plight of a schoolgirl who stole some coconuts so that her class room could be painted brightly. Kumbhakarna is deeply touched. We know that the President has not been pleased with the Judiciary lately, and this case surely gives him a terrific opportunity to point out the pig-headedness of judges and the inhumanity of our legal system in general. In short, a serious overhaul is in order, and the man has already moved more..",http://www.dailymirror.lk/opinion/172-opinion/25808-coconuts-courts-and-cultural-concoction.html
2013,Feb,19,Island,"'Reducing imports of palm oil, wont slash coconut prices'","The Coconut Growers Association (CGA) of Sri Lanka said yesterday that high import duty on palm oil and the reduction of farm gate price did not necessarily mean that the price paid by the local consumer for coconuts and coconut oil for edible purposes would drastically come down. ""It is only the increase in crop production that can generate a genuine price reduction and such increased production can only be achieved by maintaining a price structure that assures more..",http://www.island.lk/index.php?page_cat=article-details&page=article-details&code_title=72971
2013,Feb,20,DN,Teacher-killer JVP exploits coconut girl,"The manner in which the JVP engaged in mass killings including innocent teachers in the past is an open secret, Western Province Chief Minister Prasanna Ranatunga said. He was making a special statement at a meeting of the WPC in Battaramulla yesterday. The Chief Minister was replying to a statement made earlier by JVP PC member Dr Nalinda Jayatissa. Dr Jayatissa in a statement alleged that an incident which occurred at the Horana Medhankara Vidyalaya recently, more..",http://www.dailynews.lk/2013/02/20/news02.asp
2013,Feb,21,SL,Justice to all: The girl and the coconuts; dual popes and CJs,"The nations sense of justice prevailed in the case of the young girl and the 13 coconuts she is alleged to have stolen to buy paint for her school which her parents could not afford. But it left us, with little or no knowledge jurisprudence, whether justice has really been done. The cops who arrested the girl initially maintained that she had committed a non-bailable offence under the Criminal Procedure Code and that she was duly charged in courts. Those more learned in the law said more..",http://www.thesundayleader.lk/2013/02/17/justice-to-all-the-girl-and-the-coconuts-dual-popes-and-cjs/
2013,Feb,22,NS,Theft of coconuts by minor Police or Mediation Board matter?,"Just eight coconuts, worth no more than 320 rupees. Yet, for stealing them from her neighbors garden a 13-year-old teenagers future has been shred to tatters. And, all because she wanted to raise the money, requested of her, by her school authorities to paint the school buildings.The Grade 8 student of the Horana Medankara Maha Vidyalayas crime committed  early this month was considered a big enough crime to be brought more..",http://www.nation.lk/edition/fine/item/15790-theft-of-coconuts-by-minor-police-or-mediation-board-matter?.html
2013,Apr,27,CT,50% of coconut mills closed in Wayamba,"Some 10,000 workers employed in the coconut mills in the North-Western Province (NWP) have lost their jobs, with the closure of more than 50% of the mills in the Province in the recent past. Although there were 23 coconut mills in the NWP, at present only 11 are functioning, sources said. There are 51 coconut mills registered with the Coconut Development Board islandwide. Out of them, 23 mills are located in the Kurunegala and Puttalam Districts. The main reasons for more..",http://www.ceylontoday.lk/51-30789-news-detail-50-of-coconut-mills-closed-in-wayamba.html
2013,May,28,CT,Sri Lankas culture of impunity and prosecuting for picking coconuts,"Several incidents in the recent past where criminal acts were committed by persons in the presence of law enforcement authorities with impunity, has posed the question whether the criminal law and procedure in our country is selective and of course whether administration of justice is selective. The incidents which comes to mind are the tie up of a public officer to a tree by a minister in the presence of several police officers, govt officials, and the public, the attack more..",http://www.colombotelegraph.com/index.php/sri-lankas-culture-of-impunity-and-prosecuting-for-picking-coconuts/
2013,,,,Drought resistant coconut trees an urgent need: Coconut growers,"July 9 (DM) Climate change has invariably taken its toll on the countrys coconut cultivation considerably and thus, the growers are calling for drought and temperature resistant coconut plants as an urgent need. Despite erratic weather condition, the coconut had the expected crop last year. However, the subject ministry predicts this years production to fall at least by 20 percent due to dry weather prevailing in the Chilaw, Puttalam and Kurunegala areas. We have already had a taste of the changing more..",http://www.dailymirror.lk/business/features/32106-drought-resistant-coconut-trees-an-urgent-need-coconut-growers-.html
2013,Oct,26,LR,Sri Lanka coconut milk Arayuma wins Fair Trade award,"A special award was presented to the company Arayuma recently in Toronto for their product Premium Organic Coconut Milk, voted Canadas Favorite Fairtrade Product for 2013 by a large number of Canadians during Fair Trade Fortnight. The Fair Trade Fortnight is an annual two-week blitz celebrating and promoting all Fair Trade, taking place during May 1st to 15th. Fairtrade Canada presented this award to more..",http://lankareporter.com/lr/2013/10/21/2985/
2013,Nov,30,SM,Palm oil mixed in Coconut oil,"Govt analysts reports have revealed that certain coconut oil products available in the islands market have been mixed with palm oil and vegetable oil. Palm and vegetable oil which are cheaper oil products have been mixed with coconut oil producing an inferior product, the report revealed. The Consumer Affairs Authority (CAA) deputy director Asela Bandara stated that, the scam was revealed in a sample testing conducted following complaints received from the consumers. more..",http://www.srilankamirror.lk/news/12067-palm-oil-mixed-in-coconut-oil
2013,Nov,30,SM,Palm oil mixed in Coconut oil,"Govt analysts reports have revealed that certain coconut oil products available in the islands market have been mixed with palm oil and vegetable oil. Palm and vegetable oil which are cheaper oil products have been mixed with coconut oil producing an inferior product, the report revealed. The Consumer Affairs Authority (CAA) deputy director Asela Bandara stated that, the scam was revealed in a sample testing conducted following complaints received from the consumers. more..",http://www.srilankamirror.lk/news/12067-palm-oil-mixed-in-coconut-oil
2013,Dec,3,DN,Coconut revenue to top Rs 50 b,"The projected total coconut revenue in Sri Lanka is anticipated to reach a statistical figure of Rs. 50 billion with a total consumption of nearly 2600 million nuts by the end of this year, Chairman of the Coconut Development Authority (CDA), Anura Gunawardena said.  There had been a drop in the production of coconut and hence there had been a decline in kernel related productions in the market. The production of mattress fibre, twisted fibre and coconut shell charcoal were recorded as low, more..",http://www.dailynews.lk/business/coconut-revenue-top-rs-50-b?
2013,Dec,24,DM,Picking of coconuts a crime while possessing heroin isnt,"According to the latest news circulating in the country, ten kilograms of heroin has been seized from Hikkaduwa area. The police say it is the largest haul of heroin seized from the South. It is as if a competition is being held just like competitions for Super Star, Reality Star or Mega Star to find a Heroin Star. Heroin is found not in ounces or grams but in kilos. The biggest haul of heroin seized in Asia was seized more..",http://www.dailymirror.lk/opinion/172-opinion/40668-picking-of-coconuts-a-crime-while-possessing-heroin-isnt-.html
2013,Dec,28,CT,Coconuts at discounted prices,"Large coconuts will be sold at a discounted price of Rs 45 each at three places around Colombo, according to the Ministry of Coconut Development and Janatha Estate Development (CDJED). The statement issued by the ministry stated that the three places; No 11, Duke Street, Fort (Kilo Plantation), Coconut Development Authority (CDA) Narahenpita and the Denzil Kobbekaduwa Centre Battaramulla will more..",http://www.ceylontoday.lk/16-51288-news-detail-coconuts-at-discounted-prices.html
2014,Mar,19,ST,Cyber Concepts helps to launch online coconut auction,"Cyber Concepts, one of Sri Lankas leading software and web solution companies, is partnering with the Coconut Development Authority (CDA) to develop a technologically-advanced coconut auction system in Sri Lanka. Introducing e-marketing concepts is an idea put forward by Minister Jagath Pushpakumara, and implementing this proposal was delegated to the Coconut Development Authority by Nihal Somaweera, Secretary of Ministry of Coconut more..",http://www.sundaytimes.lk/140316/business-times/cyber-concepts-helps-to-launch-online-coconut-auction-88898.html
2014,Mar,22,Island,The flight paths of coconuts and astrologers,"Malaysian Airlines Flight MH370 remains in the headlines due to the vast mystery it has so far produced by vanishing from all known air routes, and the likely tragedy involved.   While the news from Australia gives some hope of at least knowing what may have happened to this flight and taking the mystery out of it, there are other matters of interest this vanishing flight has given rise to. Within days of the mystery of this flight deepening, one saw the emergence of more..",http://www.island.lk/index.php?page_cat=article-details&page=article-details&code_title=100184
2014,Mar,23,SO,Beware of polluted coconut oil barrels  CAA,"The Consumer Affairs Authority (CAA) has asked wholesale dealers to refrain from using empty barrels to store coconut oil and other edible oils, unless they are washed thoroughly to eliminate the harmful chemicals. We recently found over eighty 200-litre barrels which had been used earlier to store toxic chemicals and later used to store coconut oil without being washed.  This is a serious offence as it poses a grave health risk, Deputy Director General CAA, Asela Bandara said. more..",http://www.sundayobserver.lk/2014/03/23/new03.asp
2014,Mar,26,Hindu,Lankan companies keen on tie-ups with Kerala firms in coconut sector,"Sri Lankan companies have shown interest in business tie-ups with Kerala-based companies in setting up coconut products manufacturing facilities. The shortage of coconuts in the island nation due to rapid urbanisation has prompted these firms to try investments in Kerala. Prominent among them are Hayleys and CIC, Shivdas Menon, Chairman of Made in Kerala, a CII initiative, said. Menon, who led a 10-member CII delegation jointly with the Govt to Sri Lanka, more..",http://www.thehindubusinessline.com/news/states/lankan-companies-keen-on-tieups-with-kerala-firms-in-coconut-sector/article5835783.ece
2014,Apr,11,Island,Big jump in coconut product exports,"Sri Lanka coconut related exports had increased 94% at the beginning of this year compared to the same period last year. In January this year, Sri Lanka earned Rs. 4,768 million from coconut related products, 94% increase from the same period in 2013. In January last year it was Rs. 2463.43 million. The total coconut related products export revenue in 2013 stood at Rs. 44,952 million. more..",http://www.island.lk/index.php?page_cat=article-details&page=article-details&code_title=101468
2014,Apr,13,CT,A Model Coconut Park in Pasikuda,A model Coconut Park is to be opened adjoining to Pasikudah Bay with the aim of developing tourism. The Ministry of Coconut Development and Janatha Estate Development and Coconut Development Board has chosen Pasikuda for the project taking into consideration the tourists that visit Pasikuda in thousands. The park is being constructed in an area of over 238 acres. Another 25 acres adjoining this estate will be developed as a tourist zone. more..,http://www.ceylontoday.lk/16-61688-news-detail-a-model-coconut-park-in-pasikuda.html
2014,,,,Parents of every newborn to plant a coconut sapling,"Apr 14  (SO) The Ministry of Coconut Development has launched a novel project to encourage people grow more coconut trees in the island. Accordingly, newly-born babies and their mothers are gifted with two quality coconut seedlings free of charge. The parents have to plant these coconut seedlings in their home gardens. It is real dowry for the children and parents never forget the birthday of the child. We hope to distribute 2.5 million coconut seedlings during next two years under more..",http://www.sundayobserver.lk/2014/04/13/new40.asp
2014,Apr,15,ST,Sri Lankan inventor designs coconut shell portable cooker,"Due to the high cost of living with often price increases of goods and high taxes, it has been an ongoing struggle to maintain household expenses. The spiralling costs of electricity and gas are unbearable. Sri Lankans are now looking for cheaper alternatives to costly electricity and fuel use. Tenison Perera, owner of Asiri Hotel, Tudella, Ja-Ela, using a simple but unique technology, has invented a cooker using coconut shells or coconut shell charcoal. more..",http://www.sundaytimes.lk/140413/business-times/sri-lankan-inventor-designs-coconut-shell-portable-cooker-92066.html
2014,Apr,15,NF,Facts on coconut and oil production come to the surface,"Reports from the Central Bank indicate a 14.5% drop in coconut production in 2013 compared to 2012. The reports add that this decline has been attributed to the decline in the  production of coconut oil and other related products. The 2,940 million coconuts that were plucked in 2012 had dropped to 2,513. The report indicates that the low rainfall received in the coconut triangle has  caused this drop in production. 72% of the total coconut oil production had been used for cooking more..",http://newsfirst.lk/english/2014/04/reason-behind-fall-coconut-production/30489
2014,,,,Rise in coconut product exports,"June 3 (DN) Sri Lankas coconut related exports increased by 86% during the first quarter of this year compared to 2011. The Coconut Development and Janatha Estate Development Ministry was established in 2011 as a new Cabinet ministry. According to ministry statistics, during the first quarter of this year, Sri Lanka earned over Rs. 5,090 million from coconut related products, an 88% increase from the same period in 2011. In the first quarter of 2011 it was Rs. 2,115 million. more..",http://www.dailynews.lk/?q=local/rise-coconut-product-exports
2014,,,,Cocotech 2014: Conference and Coconut Festival in Sri Lanka,"July 4 (DN) Arrangements are in place to hold 46th Asia Pacific Coconut Community COCOTECH Conference & Coconut Festival 2014 in SL under the theme 'Policies, programs and technologies towards a resilient and sustainable coconut sector', Minister Jagath Pushpakumara said. Event will be hosted from July 7 to 11 with participation of over 150 experts from 27 countries including India, Indonesia, Malaysia, Kenya, Solomon Islands, Thailand, Vietnam and Tongo. more..",http://www.dailynews.lk/?q=local/over-27-countries-discuss-development-measures
2014,,,,CRI scientists to assist coconut development in Tanzania,"July 25 (Island) A memorandum of understanding (MOU) to assist Tanzania in coconut development was signed between the government of Sri Lanka and the United Republic of Tanzania at the Ministry of External Affairs, Colombo on July 21. Jagath Pushpakumara, Minister of Coconut Development and Janatha Estate Development signed the MOU on behalf of the government of Sri Lanka and Bernard K. Membe, Foreign Minister of Tanzania signed on behalf of Tanzania. more..",http://www.island.lk/index.php?page_cat=article-details&page=article-details&code_title=107308
2014,Oct,11,ST,Virgin coconut oil exports come to a boil,"The growing popularity for virgin coconut oil overseas has brought a remarkable rise in exports  but Sri Lankans are yet to recognise its benefits. Exports in the first seven months of this year brought in close to Rs. 2,500 million, up from Rs. 1,500m in the whole of last year. This is a 146% increase compared to last year. There is a demand for Sri Lankan virgin coconut oil from US, Europe, Japan & South Korea. more..",http://www.sundaytimes.lk/141005/news/virgin-coconut-oil-exports-come-to-a-boil-121218.html
2014,Oct,15,CT,Coconut attack on SLTB bus,"A Trincomalee bound Sri Lanka Transport Board passenger bus, of the Kilinochchi Depot, was attacked with coconuts, by an unidentified group, at 2 a.m. yesterday at the Mankulam junction. This passenger bus was heading towards Trincomalee, from Mullaitivu. When the bus stopped at Mankulam junction for a short break, to allow passengers to relieve themselves, it came under the coconut attack ,according to the driver and the conductor of the bus. more..",http://www.ceylontoday.lk/51-75455-news-detail-coconut-attack-on-sltb-bus.html
2014,Nov,12,SO,Burnt coconut shells bring Rs 9.5 b in forex,"Coconut Development Authority (CDA) has launched a project to produce activated carbon using burnt coconut shell. Nearly 50% coconut shell is used in the production process and Rs. 9.5 billion foreign exchange was earned by exporting activated carbon, CDA Chairman Aruna Gunawardane said.  He said the sad part was that a similar percentage was going waste every year. When the entire collection is used in more..",http://www.sundayobserver.lk/2014/11/09/fea06.asp
2014,Dec,2,GDI,Big demand for Sri Lankan Coconut Water,"There is a big demand for Sri Lankan coconut water in the international market and coconut water is exported in the form of an energetic drink. A large number of investors have come forward to invest in this sector, the Ministry of Coconut Development and Janatha Estates Development revealed. Coconut water is becoming popular in the world beverage trade as it is pure and refreshing and highly nutritious compared to manufactured beverages. more..",http://www.news.lk/news/business/item/4788-big-demand-for-sri-lankan-coconut-water
2014,Dec,6,ST,Rural Sri Lankan entrepreneur develops adjustable coconut plucking pole,"While Sri Lankas rural innovative technological talent is wide ranging compared to the talent pool in urban areas, there is need for a process of identifying and promoting them to start up businesses. This is the very task that has been undertaken by the National Science Foundation (NSF), which operates under the purview of Ms Anusha Amarasinghe, its Director General. To prove their attempts and in a bid to muster the virgin talent of the rural people, more..",http://www.sundaytimes.lk/141130/business-times/rural-sri-lankan-entrepreneur-develops-adjustable-coconut-plucking-pole-129551.html
2014,Dec,17,SL,Logic of Coconut and Bo trees in a presidential election,"Its not easy to reconcile Sri Lankan election rhetoric with elementary logic. One such challenge we faced watching a late night TV talk show, these talk shows being of interest to us not as a political columnist or student of politics but for sheer entertainment. On Tuesday night we wondered why a speaker was holding forth on the virtues of the Coconut tree with much eloquence. Roots of tree are used as a fuel for cooking in our humble homes, the trunk is of hardy wood more..",http://www.thesundayleader.lk/2014/12/14/logic-of-coconut-and-bo-trees-in-a-presidential-election/
2014,Dec,23,GDI,Sri Lanka's Desiccated Coconut exports records a 148% increase,Sri Lanka has recorded a remarkable 148% increase during the first eight months of this year in Desiccated Coconut exports compared to the same period in 2013. Sri Lanka has exported 26115 M/T in 2014 against 10530 M/T for the same period in 2013 for the period referred to above. Sri Lanka's D/C exports are likely to have a bright future from a short and medium term market perspective due to more..,http://www.news.lk/news/business/item/5262-sri-lanka-s-desiccated-coconut-exports-records-a-148-increase
2015,Feb,3,Island,Coconutbecomes Kingthanks to Silvermill Holdings,"Coconut, coconut plantations, smallholders, or in general terms the coconut industry, over the past two decades or so constantly relegated to the backroom of the plantation industry, emerged to claim some degree of importance, thanks to Silvermill Holdings Ltd. CEO Silvermill Holdings, Suresh Silva, launching the product, Silvermill Real Coconut Milk, last week said the Company was in existence since 1920, exporting value added coconut products, more..",http://www.island.lk/index.php?page_cat=article-details&page=article-details&code_title=118810
2015,Mar,17,ST,CDA to crack down on substandard virgin coconut oil companies,"The growing demand for Sri Lankas virgin coconut oil overseas especially in Europe and importance of curbing substandard exports has prompted the Coconut Development Authority (CDA) to crack down on bogus virgin coconut oil companies, the CDA chief said. There is strong demand for Sri Lankan virgin coconut oil from the US, Europe, Japan and South Korea and exports from Sri Lanka has increased by around 140 per cent last year compared to 2013. more..",http://www.sundaytimes.lk/150315/business-times/cda-to-crack-down-on-substandard-virgin-coconut-oil-companies-139686.html
